{
  "schema_version": 1,
  "stable_id": "vibesec.catalog.cli",
  "status": "stable",
  "summary": "Root CLI commands, subcommand families, result envelopes, exit codes, and execution selection.",
  "source": "vibesec",
  "human_documentation": ["docs/local-execution.md", "docs/v1-interface-reference.md"],
  "members": ["vibesec.cli.agents", "vibesec.cli.doctor", "vibesec.cli.extensions", "vibesec.cli.init", "vibesec.cli.scan", "vibesec.cli.upgrade-plan", "vibesec.cli.verify", "vibesec.execution.modes", "vibesec.results.lifecycle", "vibesec.runtime.exit-codes"],
  "statuses": {
    "vibesec.cli.agents": "stable",
    "vibesec.cli.doctor": "stable",
    "vibesec.cli.extensions": "stable",
    "vibesec.cli.init": "stable",
    "vibesec.cli.scan": "stable",
    "vibesec.cli.upgrade-plan": "stable",
    "vibesec.cli.verify": "stable",
    "vibesec.execution.modes": "experimental",
    "vibesec.results.lifecycle": "stable",
    "vibesec.runtime.exit-codes": "stable"
  }
}
