{
  "schema_version": 1,
  "stable_id": "vibesec.catalog.capabilities",
  "status": "stable",
  "summary": "Public capability IDs from the questionnaire and accountability matrix.",
  "source": "config/security-capabilities.json",
  "human_documentation": ["docs/project-capabilities.md", "docs/security-capability-matrix.md", "docs/v1-interface-reference.md"],
  "members": ["api.content-type-conformance", "api.negative-data-rejection", "api.negative-generation", "api.openapi-schema-validation", "api.policy-enforcement", "api.positive-data-acceptance", "api.positive-generation", "api.response-schema-conformance", "api.result-normalization", "api.server-error-detection", "api.status-code-conformance", "api.tool-failure-handling", "api.trusted-event-isolation", "authenticated.bearer-configuration-validation", "authenticated.correlation", "authenticated.evidence", "authenticated.missing-secret-handling", "authenticated.openapi-testing", "authenticated.passive-dast", "authenticated.scanner-step-secret-scoping", "authenticated.secret-redaction", "authenticated.tool-failure-handling", "dast.artifact-sanitization", "dast.cleanup", "dast.failure-paths", "dast.isolated-runtime", "dast.normalization", "dast.policy-gate", "dast.target-validation", "dast.trusted-event", "dast.zap-passive-baseline", "fuzzing.bounded-active-api", "minimal.actionlint", "minimal.gitleaks", "minimal.result-policy", "minimal.trivy-filesystem", "standard.checkov-iac", "standard.coverage-report", "standard.finding-intelligence", "standard.opengrep-sast", "standard.osv-dependencies", "standard.profile-baselines", "standard.repository-inventory", "standard.syft-sbom", "standard.trivy-image", "standard.trusted-harness", "vibesec.capabilities.registry"],
  "statuses": {
    "api.content-type-conformance": "conditionally_enforced",
    "api.negative-data-rejection": "conditionally_enforced",
    "api.negative-generation": "conditionally_enforced",
    "api.openapi-schema-validation": "stable",
    "api.policy-enforcement": "stable",
    "api.positive-data-acceptance": "conditionally_enforced",
    "api.positive-generation": "conditionally_enforced",
    "api.response-schema-conformance": "conditionally_enforced",
    "api.result-normalization": "stable",
    "api.server-error-detection": "conditionally_enforced",
    "api.status-code-conformance": "conditionally_enforced",
    "api.tool-failure-handling": "stable",
    "api.trusted-event-isolation": "stable",
    "authenticated.bearer-configuration-validation": "stable",
    "authenticated.correlation": "stable",
    "authenticated.evidence": "stable",
    "authenticated.missing-secret-handling": "stable",
    "authenticated.openapi-testing": "conditionally_enforced",
    "authenticated.passive-dast": "conditionally_enforced",
    "authenticated.scanner-step-secret-scoping": "stable",
    "authenticated.secret-redaction": "stable",
    "authenticated.tool-failure-handling": "stable",
    "dast.artifact-sanitization": "stable",
    "dast.cleanup": "stable",
    "dast.failure-paths": "stable",
    "dast.isolated-runtime": "stable",
    "dast.normalization": "stable",
    "dast.policy-gate": "stable",
    "dast.target-validation": "stable",
    "dast.trusted-event": "stable",
    "dast.zap-passive-baseline": "conditionally_enforced",
    "fuzzing.bounded-active-api": "conditionally_enforced",
    "minimal.actionlint": "stable",
    "minimal.gitleaks": "stable",
    "minimal.result-policy": "stable",
    "minimal.trivy-filesystem": "stable",
    "standard.checkov-iac": "conditionally_enforced",
    "standard.coverage-report": "stable",
    "standard.finding-intelligence": "stable",
    "standard.opengrep-sast": "stable",
    "standard.osv-dependencies": "stable",
    "standard.profile-baselines": "stable",
    "standard.repository-inventory": "stable",
    "standard.syft-sbom": "stable",
    "standard.trivy-image": "conditionally_enforced",
    "standard.trusted-harness": "stable",
    "vibesec.capabilities.registry": "stable"
  }
}
