{
  "schema_version": 1,
  "stable_id": "vibesec.catalog.artifacts",
  "status": "stable",
  "summary": "Sanitized scan, lifecycle, bundle, SBOM, provenance, and release artifact names.",
  "source": "config/supply-chain-policy.json",
  "human_documentation": ["docs/software-supply-chain-assurance.md", "docs/provenance.md", "docs/v1-interface-reference.md"],
  "members": ["SHA256SUMS", "config/api-fuzzing-result-schema.json", "config/api-security-result-schema.json", "config/extension-manifest-schema.json", "config/finding-groups-schema.json", "config/prioritized-findings-schema.json", "config/provenance-schema.json", "config/release-manifest-schema.json", "config/zap-passive-plan-schema.json", "coverage.json", "finding-groups.json", "fuzzing-coverage.json", "fuzzing-findings.json", "fuzzing-policy-result.json", "fuzzing-report.md", "inventory.json", "machine/schemas/agent-adapter.schema.json", "machine/schemas/agent-contract.schema.json", "machine/schemas/agent-task.schema.json", "machine/schemas/domain-catalog.schema.json", "machine/schemas/public-interface.schema.json", "machine/schemas/release-readiness.schema.json", "normalized.json", "policy-result.json", "prioritized-findings.json", "provenance.intoto.jsonl", "release-manifest.json", "release-readiness.json", "report.md", "sbom.cyclonedx.json", "sbom.spdx.json", "vibesec-consumer-bundle.zip", "vibesec.artifacts.security"],
  "statuses": {
    "SHA256SUMS": "stable",
    "config/api-fuzzing-result-schema.json": "stable",
    "config/api-security-result-schema.json": "stable",
    "config/extension-manifest-schema.json": "stable",
    "config/finding-groups-schema.json": "stable",
    "config/prioritized-findings-schema.json": "stable",
    "config/provenance-schema.json": "stable",
    "config/release-manifest-schema.json": "stable",
    "config/zap-passive-plan-schema.json": "stable",
    "coverage.json": "stable",
    "finding-groups.json": "stable",
    "fuzzing-coverage.json": "stable",
    "fuzzing-findings.json": "stable",
    "fuzzing-policy-result.json": "stable",
    "fuzzing-report.md": "stable",
    "inventory.json": "stable",
    "machine/schemas/agent-adapter.schema.json": "stable",
    "machine/schemas/agent-contract.schema.json": "stable",
    "machine/schemas/agent-task.schema.json": "stable",
    "machine/schemas/domain-catalog.schema.json": "stable",
    "machine/schemas/public-interface.schema.json": "stable",
    "machine/schemas/release-readiness.schema.json": "stable",
    "normalized.json": "stable",
    "policy-result.json": "stable",
    "prioritized-findings.json": "stable",
    "provenance.intoto.jsonl": "stable",
    "release-manifest.json": "stable",
    "release-readiness.json": "stable",
    "report.md": "stable",
    "sbom.cyclonedx.json": "stable",
    "sbom.spdx.json": "stable",
    "vibesec-consumer-bundle.zip": "stable",
    "vibesec.artifacts.security": "stable"
  }
}
